{
  "$id": "urn:ratatoskr:contracts:events:v1:AiArchiveTombstone",
  "$schema": "https://json-schema.org/draft/2020-12/schema",
  "title": "AiArchiveTombstone",
  "description": "Payload of `ai_archive.subject.tombstoned.v1`: authoritative deletion evidence.\n\nThe fact is emitted only from provider deletion, compliance deletion, an\napproved reconciliation policy, or an authenticated owner privacy request.\nIt never represents an object merely missing from one snapshot.\n\n`owner` is the Platform tenant the data belongs to, `user:<platform user uuid>`, which is\nalso the tenant `ratatoskr-knowledge` indexes under. It is never an identity local to the\narchive service. `evidence_ref` names a producer-owned blob that carries no timestamp and no\ncontent, so repeating a deletion request yields the same reference. `subject` of kind\n`archive` means the whole `ai_archive_id`; the other kinds name one conversation, project or\nArtifact inside it. The publisher stores the complete event envelope and relays it unchanged,\nso a retry never mints a second payload.",
  "type": "object",
  "properties": {
    "ai_archive_id": {
      "description": "Archive import that contained the subject when the evidence was recorded.",
      "$ref": "#/$defs/AiArchiveId"
    },
    "evidence_ref": {
      "description": "Immutable raw evidence for the deletion decision.",
      "$ref": "#/$defs/BlobRef"
    },
    "observed_at": {
      "description": "Instant the producer observed the authoritative deletion evidence.",
      "$ref": "#/$defs/WireTimestamp"
    },
    "owner": {
      "description": "Tenant that owned the archive subject.",
      "$ref": "#/$defs/TenantRef"
    },
    "parser": {
      "description": "Parser identity when a parser created the tombstone during reconciliation.",
      "anyOf": [
        {
          "$ref": "#/$defs/AiArchiveTombstoneParser"
        },
        {
          "type": "null"
        }
      ]
    },
    "provider": {
      "description": "Provider that owned the archive subject.",
      "$ref": "#/$defs/AiProvider"
    },
    "reason": {
      "description": "Authoritative source of the deletion decision.",
      "$ref": "#/$defs/AiArchiveTombstoneReason"
    },
    "subject": {
      "description": "The exact archive subject made unavailable.",
      "$ref": "#/$defs/AiArchiveTombstoneSubject"
    }
  },
  "additionalProperties": true,
  "required": [
    "ai_archive_id",
    "evidence_ref",
    "observed_at",
    "owner",
    "provider",
    "reason",
    "subject"
  ],
  "x-ratatoskr-provenance": {
    "canonical_source": "ratatoskr_ai_archive_contracts::AiArchiveTombstone",
    "contract_id": "ai_archive.subject_tombstoned",
    "contract_major_version": 1,
    "generated": "DO NOT EDIT — generated by contractsc from the canonical Rust source. Change the Rust type and run `cargo contracts generate`.",
    "generator": "contractsc",
    "generator_version": "0.1.0",
    "schemars_version": "1.2.2",
    "source_digest": "sha256:264677925a096557419fc53ff7a7678e573ecabe50e6d7ec83b7acda8f22c5a2",
    "validation_note": "This schema is a LOWER BOUND on validity. Cross-field invariants and canonical-form rules are enforced by the canonical Rust type; see fixtures/invalid-expectations.toml for which layer rejects what."
  },
  "x-ratatoskr-unknown-policy": "preserve",
  "$defs": {
    "AiArchiveId": {
      "title": "AiArchiveId",
      "description": "Identity of one import of a provider AI account export. Bare canonical lowercase hyphenated UUID; not namespaced.",
      "type": "string",
      "format": "uuid",
      "examples": [
        "018f0000-0000-7000-8000-000000000001"
      ],
      "pattern": "^[0-9a-f]{8}-[0-9a-f]{4}-[0-9a-f]{4}-[0-9a-f]{4}-[0-9a-f]{12}$"
    },
    "AiArchiveTombstoneParser": {
      "description": "Optional parser identity for a tombstone created during parser-driven reconciliation.",
      "type": "object",
      "properties": {
        "parser_name": {
          "description": "Parser that created the tombstone record.",
          "$ref": "#/$defs/ParserName"
        },
        "parser_version": {
          "description": "Version of the parser that created the tombstone record.",
          "$ref": "#/$defs/ParserVersion"
        }
      },
      "additionalProperties": true,
      "required": [
        "parser_name",
        "parser_version"
      ],
      "x-ratatoskr-unknown-policy": "preserve"
    },
    "AiArchiveTombstoneReason": {
      "title": "AiArchiveTombstoneReason",
      "description": "An authoritative reason why an AI-archive subject was tombstoned.",
      "type": "string",
      "examples": [
        "provider_deletion_event",
        "compliance_event",
        "reconciliation_policy",
        "user_requested"
      ],
      "maxLength": 32,
      "pattern": "^(provider_deletion_event|compliance_event|reconciliation_policy|user_requested)$"
    },
    "AiArchiveTombstoneSubject": {
      "description": "The archive record made unavailable by an authoritative tombstone fact.",
      "oneOf": [
        {
          "description": "The entire archive import named by the enclosing `ai_archive_id`.",
          "type": "object",
          "properties": {
            "subject_kind": {
              "type": "string",
              "const": "archive"
            }
          },
          "required": [
            "subject_kind"
          ]
        },
        {
          "description": "One conversation belonging to the enclosing archive import.",
          "type": "object",
          "properties": {
            "ai_conversation_id": {
              "description": "Ratatoskr identity of the tombstoned conversation.",
              "$ref": "#/$defs/AiConversationId"
            },
            "subject_kind": {
              "type": "string",
              "const": "conversation"
            }
          },
          "required": [
            "ai_conversation_id",
            "subject_kind"
          ]
        },
        {
          "description": "One project belonging to the enclosing archive import.",
          "type": "object",
          "properties": {
            "ai_project_id": {
              "description": "Ratatoskr identity of the tombstoned project.",
              "$ref": "#/$defs/AiProjectId"
            },
            "subject_kind": {
              "type": "string",
              "const": "project"
            }
          },
          "required": [
            "ai_project_id",
            "subject_kind"
          ]
        },
        {
          "description": "One provider Artifact belonging to the enclosing archive import.",
          "type": "object",
          "properties": {
            "external_artifact_id": {
              "description": "Provider-minted identity of the tombstoned Artifact.",
              "$ref": "#/$defs/EntityLocalId"
            },
            "subject_kind": {
              "type": "string",
              "const": "artifact"
            }
          },
          "required": [
            "external_artifact_id",
            "subject_kind"
          ]
        }
      ]
    },
    "AiConversationId": {
      "title": "AiConversationId",
      "description": "Identity of one normalized AI conversation. Bare canonical lowercase hyphenated UUID; not namespaced.",
      "type": "string",
      "format": "uuid",
      "examples": [
        "018f0000-0000-7000-8000-000000000001"
      ],
      "pattern": "^[0-9a-f]{8}-[0-9a-f]{4}-[0-9a-f]{4}-[0-9a-f]{4}-[0-9a-f]{12}$"
    },
    "AiProjectId": {
      "title": "AiProjectId",
      "description": "Identity of one normalized AI project. Bare canonical lowercase hyphenated UUID; not namespaced.",
      "type": "string",
      "format": "uuid",
      "examples": [
        "018f0000-0000-7000-8000-000000000001"
      ],
      "pattern": "^[0-9a-f]{8}-[0-9a-f]{4}-[0-9a-f]{4}-[0-9a-f]{4}-[0-9a-f]{12}$"
    },
    "AiProvider": {
      "title": "AiProvider",
      "description": "The AI provider an archive came from, e.g. `chatgpt`, `claude`.\n\n**Open on purpose.** A validated token, not an enum: a provider added by a later milestone\nmust not break a running consumer, and no consumer may assume the vocabulary is\nexhaustive. Branch on equality with known tokens; treat everything else generically. The\ngrammar is the event-type segment grammar (`EventType::SEGMENT_PATTERN`), so one\nsnake_case alphabet covers both.",
      "type": "string",
      "examples": [
        "chatgpt",
        "claude"
      ],
      "maxLength": 32,
      "pattern": "^[a-z][a-z0-9_]{0,31}$"
    },
    "BlobOwner": {
      "title": "BlobOwner",
      "description": "Deployment identity of the service that owns and resolves a blob.",
      "type": "string",
      "examples": [
        "ratatoskr-extractor",
        "ratatoskr-vault"
      ],
      "maxLength": 64,
      "pattern": "^[a-z][a-z0-9-]{1,63}$"
    },
    "BlobRef": {
      "description": "Reference to content-addressed bytes owned by one service.\n\nThis is a reference, not a storage API. The owner writes and resolves the bytes under its own\ncontent-addressed directory. No host, filesystem path, signed URL, credentials, or expiry can\nappear in this contract.",
      "type": "object",
      "properties": {
        "digest": {
          "description": "Digest that names the bytes and lets a reader verify them.",
          "$ref": "#/$defs/ContentDigest"
        },
        "length_bytes": {
          "description": "Exact byte length of the stored value.",
          "type": "integer",
          "format": "uint64",
          "minimum": 0
        },
        "media_type": {
          "description": "Media type of the stored bytes.",
          "$ref": "#/$defs/MediaType"
        },
        "owner_service": {
          "description": "Service that owns the bytes and their lifecycle.",
          "$ref": "#/$defs/BlobOwner"
        }
      },
      "additionalProperties": false,
      "required": [
        "digest",
        "length_bytes",
        "media_type",
        "owner_service"
      ]
    },
    "ContentDigest": {
      "description": "A content digest with an explicit algorithm.",
      "type": "object",
      "properties": {
        "algorithm": {
          "description": "Hash algorithm used to produce `hex`.",
          "$ref": "#/$defs/DigestAlgorithm"
        },
        "hex": {
          "description": "Lowercase hexadecimal digest bytes.",
          "$ref": "#/$defs/DigestHex"
        }
      },
      "additionalProperties": false,
      "required": [
        "algorithm",
        "hex"
      ]
    },
    "DigestAlgorithm": {
      "description": "Algorithm used to calculate a content digest.",
      "oneOf": [
        {
          "description": "SHA-256.",
          "type": "string",
          "const": "sha256"
        }
      ]
    },
    "DigestHex": {
      "title": "DigestHex",
      "description": "Lowercase hexadecimal bytes of a content digest.",
      "type": "string",
      "examples": [
        "0000000000000000000000000000000000000000000000000000000000000000"
      ],
      "maxLength": 64,
      "pattern": "^[0-9a-f]{64}$"
    },
    "EntityLocalId": {
      "title": "EntityLocalId",
      "description": "The identity half of a qualified reference. Opaque: a UUID, a provider's numeric string,\nor a provider slug. May contain `:`, because the kind separator is the FIRST colon only.",
      "type": "string",
      "examples": [
        "018f0000-0000-7000-8000-000000000002",
        "123"
      ],
      "maxLength": 256,
      "pattern": "^[A-Za-z0-9][A-Za-z0-9._~:@+-]{0,255}$"
    },
    "MediaType": {
      "title": "MediaType",
      "description": "Internet media type of stored bytes, without parameters.",
      "type": "string",
      "examples": [
        "text/html",
        "application/pdf"
      ],
      "maxLength": 255,
      "pattern": "^[a-z0-9][a-z0-9!#$&^_.+-]{0,126}/[a-z0-9][a-z0-9!#$&^_.+-]{0,126}$"
    },
    "ParserName": {
      "title": "ParserName",
      "description": "Which parser normalized a node, e.g. `chatgpt_export`, `claude_export`.\n\n**Open on purpose**, like [`AiProvider`]: a parser rename or addition must not break a\nrunning consumer. Opaque to consumers beyond display and staleness comparison; no\nconsumer may branch on its internals.\n\n[`AiProvider`]: crate::AiProvider",
      "type": "string",
      "examples": [
        "chatgpt_export",
        "claude_export"
      ],
      "maxLength": 32,
      "pattern": "^[a-z][a-z0-9_]{0,31}$"
    },
    "ParserVersion": {
      "title": "ParserVersion",
      "description": "The build of the [`ParserName`] that normalized a node.\n\nBounded printable ASCII without whitespace: semver (`1.4.2`), date-based (`2026.08.1`)\nand commit-sha spellings all fit. Deliberately **not** semver-typed — parsers version in\nmore than one scheme, and any tighter grammar would reject an honest stamp. Consumers MAY\ncompare stamps for staleness; none may parse them for semantics.\n\n[`ParserName`]: crate::ParserName",
      "type": "string",
      "examples": [
        "1.4.2",
        "2026.08.1"
      ],
      "maxLength": 64,
      "pattern": "^[!-~]{1,64}$"
    },
    "TenantRef": {
      "title": "TenantRef",
      "description": "The owner of the data a record concerns, wire form `user:<uuid>`. The kind set is closed: a consumer that cannot understand the owner kind must reject the record rather than process it.",
      "type": "string",
      "examples": [
        "user:018f0000-0000-7000-8000-000000000005"
      ],
      "maxLength": 41,
      "pattern": "^user:[0-9a-f]{8}-[0-9a-f]{4}-[0-9a-f]{4}-[0-9a-f]{4}-[0-9a-f]{12}$"
    },
    "WireTimestamp": {
      "title": "WireTimestamp",
      "description": "An instant on the wire: RFC 3339 in UTC with the literal `Z` designator. Exactly one spelling is accepted per instant — an input that does not re-render to itself is rejected. The field holding it declares the clock authority.",
      "type": "string",
      "format": "date-time",
      "examples": [
        "2026-08-17T10:00:00Z"
      ],
      "pattern": "^\\d{4}-\\d{2}-\\d{2}T\\d{2}:\\d{2}:\\d{2}(\\.\\d{1,9})?Z$"
    }
  }
}
